Name,Artist,Album,Track Number
Into the Night (Synkro Remix),Caan,Into the Night,3
Tripped (Synkro Remix),DFRNT,Chilled Deep Dubstep - 26 Chilled Dub Step Big Tunes,20
Carmine (Synkro Remix),Cloud Boat,Carmine,2
Love Is Not Enough (Synkro Remix),Above & Beyond,Love Is Not Enough (D&B/Dubstep Remixes),2
I'm Running (Synkro Remix),Dusky,Stick By This Remixed EP2,3
My Desire (Synkro Remix),Chris Coco,Eclettica by Glass Coffee,9
Inward Outburst (Synkro Remix),Lowb,Inward Outburst EP,3
Mixed Signals (Synkro Remix),Frederic Robinson,Vamp EP,4
Echoes (Synkro Remix),Tokyo Prose,Tokyo Prose Remixed,1
Daffodils (Synkro Remix),The Tommy Evans Orchestra,The Green Seagull,18
Always (Synkro Remix),Submotion Orchestra,Finest Hour The Remixes,2
Rivers (Synkro Remix),:papercutz,Rivers (At Dusk Remixed EP),2
The Funk (Synkro Remix),Rob Sparx,Origins,21
Lost in Time (Synkro Remix),Synth Sense,Tommorow’s World (Remixes),1
Tears (Synkro remix),Indigo,Zero Point,8
Fallen (Synkro remix),Indigo,Zero Point,6
